{
  "sls_id": "sls:bench:grammar:000001",
  "task": "grammar-correction",
  "input": "synthetic-benchmark-input",
  "expected_output": "synthetic-benchmark-output",
  "explanation": "Synthetic validator explanation; not an evaluation judgment.",
  "difficulty": "intermediate",
  "rule_refs": [
    "G10-R1"
  ],
  "task_data": {
    "synthetic_field": true
  },
  "metadata": {
    "contributor": "SLS maintainers",
    "source": "Synthetic structural fixture; not language data",
    "date_added": "2026-09-04",
    "review_status": "draft",
    "license": "CC BY 4.0",
    "schema_version": "1.0.0",
    "since_version": "0.3.0"
  }
}
